{
  "id": "cmake",
  "category": "build",
  "tier": "L1",
  "status": "detect-only",
  "provider": "direct",
  "name": { "zh-CN": "CMake", "en-US": "CMake" },
  "description": {
    "zh-CN": "跨平台构建系统生成器，C/C++ 项目常用。",
    "en-US": "Cross-platform build system generator, common for C/C++ projects."
  },
  "homepage": "https://cmake.org",
  "license": { "spdx": "BSD-3-Clause", "redistributable": true },
  "detect": {
    "commands": [{ "cmd": "cmake", "args": ["--version"], "expectRegex": "cmake version \\d+" }],
    "files": ["%ProgramFiles%\\CMake\\bin\\cmake.exe"],
    "registry": [
      {
        "hive": "HKLM",
        "view": "64",
        "path": "SOFTWARE\\Microsoft\\Windows\\CurrentVersion\\Uninstall",
        "match": { "DisplayName": "^CMake" },
        "versionFrom": "DisplayVersion"
      }
    ]
  },
  "versions": [],
  "notes": {
    "zh-CN": "版本信息 M2 补齐。",
    "en-US": "Version info to be filled in M2."
  }
}
